{
  "framework_id": "unesco-ai-maturity-2025",
  "framework_version": "2025",
  "assessment_id": "assess-009",
  "assessment_scope": "enterprise operations",
  "accountable_owner": "governance-function",
  "authority_effect": "NONE",
  "categories": [
    {
      "claimed_level": "READY",
      "evidence": [
        {
          "reference": "ops://partial",
          "evidence_class": "OPERATING",
          "scope": "enterprise operations"
        },
        {
          "reference": "policy://policy-only",
          "evidence_class": "POLICY",
          "scope": "enterprise operations"
        }
      ],
      "pillar_id": "ai-governance-ethics-risk",
      "category_id": "ai-governance-ethics-risk.ai-governance-framework"
    }
  ],
  "assessment_coverage": "PARTIAL"
}
