{
  "framework_id": "unesco-ai-maturity-2025",
  "framework_version": "2025",
  "assessment_id": "assess-001",
  "assessment_scope": "enterprise operations",
  "accountable_owner": "governance-function",
  "authority_effect": "NONE",
  "categories": [
    {
      "claimed_level": "DYNAMIC",
      "target_level": "DYNAMIC",
      "evidence": [
        {
          "reference": "ops://governance-operating-procedure-v3",
          "evidence_class": "OPERATING",
          "scope": "enterprise operations",
          "observed_at": "2026-09-01T00:00:00Z",
          "valid_through": "2027-09-01T00:00:00Z",
          "is_representative": true,
          "verification_method": "document-review",
          "sha256": "sha256:aaaaaaaaaaaaaaaaaaaaaaaaaaaaaaaaaaaaaaaaaaaaaaaaaaaaaaaaaaaaaaaa"
        }
      ],
      "pillar_id": "ai-governance-ethics-risk",
      "category_id": "ai-governance-ethics-risk.ai-governance-framework"
    }
  ],
  "assessment_coverage": "PARTIAL"
}
